gemm_config.in
batch_size, seq_len, head_num, size_per_head dataType ### batchCount, n, m, k, algoId, customOption, tile, numSplitsK, swizzle, reductionScheme, workspaceSize, stages, exec_time
1 332 4 240 1 ### 1 960 332 960 6 0 24 0 0 0 0 9 0.032780
1 332 4 240 1 ### 1 8 8 960 21 0 11 8 0 2 2048 19 0.008860
1 332 4 240 1 ### 1 2880 332 960 6 0 20 0 1 0 0 11 0.079501
1 332 4 240 1 ### 4 332 332 240 115 -1 -1 -1 -1 -1 -1 -1 0.092940
1 332 4 240 1 ### 4 240 332 332 101 -1 -1 -1 -1 -1 -1 -1 0.072730
1 332 4 240 1 ### 3 960 332 960 100 -1 -1 -1 -1 -1 -1 -1 0.088450
