gemm_config.in.x86
batch_size, seq_len, head_num, size_per_head dataType ### batchCount, n, m, k, algoId, customOption, tile, numSplitsK, swizzle, reductionScheme, workspaceSize, stages, exec_time
1 512 8 32 1 ### 1 256 512 256 6 0 15 1 1 0 0 17 0.006124
1 512 8 32 1 ### 1 512 24 4 23 0 11 1 0 0 0 7 0.002642
1 512 8 32 1 ### 1 24 512 256 23 0 11 2 0 1 64 20 0.006420
1 512 8 32 1 ### 1 256 512 3 0 0 16 0 1 0 0 0 0.003441
1 512 8 32 1 ### 1 512 512 256 21 0 17 1 0 0 0 12 0.007465
1 512 8 32 1 ### 1 256 512 512 6 0 15 1 1 0 0 17 0.007619
1 512 8 32 1 ### 1 8 512 256 21 0 5 3 0 4 24576 20 0.005171
1 512 8 32 1 ### 8 512 512 32 104 -1 -1 -1 -1 -1 -1 -1 0.016800
1 512 8 32 1 ### 8 32 512 512 108 -1 -1 -1 -1 -1 -1 -1 0.016830
